{
  "schemaVersion": "1.0.0",
  "id": "gol",
  "nome": "GOL Linhas Aéreas",
  "codigo": "G3",
  "lastVerified": "2026-04-16",
  "verifiedBy": "Leonardo Braga de Almeida",
  "nextReviewDate": "2026-07-16",
  "confidence": "MEDIA",
  "sources": [
    {
      "url": "https://www.voegol.com.br/informacoes/animais-de-estimacao",
      "title": "GOL — Transporte de Animais de Estimação",
      "type": "OFICIAL",
      "lastAccessed": "2026-04-16"
    }
  ],
  "changeLog": [
    {
      "date": "2026-04-16",
      "author": "Leonardo Braga de Almeida",
      "description": "Criação inicial."
    }
  ],
  "cabine": {
    "permitido": true,
    "pesoMaxKg": 10,
    "dimensoesMaxCm": {
      "comprimento": 45,
      "largura": 35,
      "altura": 25,
      "somaDimensoes": 115
    },
    "especiesPermitidas": [
      "CAO",
      "GATO"
    ],
    "racasBraquisefálicasPermitidas": false,
    "idadeMinimaSemanas": 8,
    "maxAnimaisPorVoo": 3,
    "reservaAntecedenciaHoras": 24,
    "observacoes": "Máx. 3 animais de estimação por voo na cabine (independente de cia compartilhada). Animal + caixa = máx 10kg. Reserva com mínimo 24h de antecedência pelo Fale Conosco da GOL."
  },
  "porao": {
    "permitido": true,
    "pesoMaxKg": 32,
    "racasBraquisefálicasPermitidas": false,
    "observacoes": "Consultar GOL para raças restritas no porão. Caixa rígida IATA obrigatória."
  },
  "observacoesGerais": "⚠️ Verificar disponibilidade de vagas para animais no momento da reserva — é limitado por voo.",
  "racasPerigosasBanidas": true
}
